{
  "$schema": "http://json-schema.org/draft-07/schema#",
  "title": "fleetest 実行プロファイル",
  "description": "実行プロファイル(profiles/runs/<name>.json)。apps/<app>.json への参照(name)とデバイス一覧(devices[])、実行時設定を定義する。プロジェクトの「デバイスカタログ」は全実行プロファイルの devices[] の和集合(enabled:false のものも含む)。構造の正は Sources/FTCore/RunProfile.swift の RunProfileDocument / ProfileResolver.validate。",
  "type": "object",
  "additionalProperties": true,
  "required": [
    "app",
    "devices"
  ],
  "properties": {
    "app": {
      "type": "string",
      "description": "apps/<name>.json への参照(拡張子なし)。必須。",
      "minLength": 1
    },
    "devices": {
      "type": "array",
      "description": "この実行プロファイルが使うデバイス。iOS/Android混在可(両OSを同時実行する)。1件以上必須(ただし enabled:false のみのときは実行時に弾かれる)。",
      "minItems": 1,
      "items": {
        "type": "object",
        "description": "1デバイス分の定義(DeviceSpec)。name は同じ machine の中で一意にすること(重複は検証エラーになる)。",
        "additionalProperties": true,
        "required": [
          "platform",
          "name"
        ],
        "properties": {
          "platform": {
            "type": "string",
            "enum": ["ios", "android"],
            "description": "OS 種別。必須。"
          },
          "machine": {
            "type": "string",
            "description": "このデバイスが居る機械。省略または \"local\" でこのマシン。それ以外は登録簿(fleetest remote machines)の名前で、run はそのホストへディスパッチされる。ssh 宛先は書けない(プロジェクト資産に接続先の実体を混ぜない)。ツールは常に明示で書く。"
          },
          "name": {
            "type": "string",
            "description": "デバイス識別名。一意なのは (platform, machine, name)。iOS シミュレータでは Xcode 上のシミュレータ名(simctl の name)そのもの。udid が無いときはこの名前でシミュレータを探す。",
            "minLength": 1
          },
          "enabled": {
            "type": "boolean",
            "description": "省略時 true。false はこのプロファイルの一覧には残すが実行しない(プロファイルタブのチェックボックスに対応)。",
            "default": true
          },
          "kind": {
            "type": "string",
            "enum": ["virtual", "physical"],
            "description": "デバイスの実体種別(省略時 virtual)。virtual = iOS シミュレータ / Android エミュレータ。physical = 実機(iOS は udid、Android は serial が必須。iOS 実機は engine=xcuitest 固定)。"
          },
          "osVersion": {
            "type": "string",
            "description": "OS Version as shown by Xcode / the device, with the platform prefix (e.g. \"iOS 27.0\", \"Android 13\"). iOS simulators use it (with name) to find the simulator when udid is absent; display-only otherwise."
          },
          "udid": {
            "type": "string",
            "description": "iOS: UDID。kind=virtual ならシミュレータ UDID(name/os より優先)、kind=physical なら実機 UDID(xcrun devicectl list devices の Identifier。必須)。"
          },
          "port": {
            "type": "integer",
            "description": "iOS: ブリッジポートの固定(省略時は自動採番)。",
            "minimum": 0,
            "maximum": 65535
          },
          "engine": {
            "type": "string",
            "enum": ["xcuitest", "inapp"],
            "description": "iOS: 駆動エンジン。xcuitest(既定)= XCUITest ブリッジ / inapp = シミュレータのアプリに dylib 注入する in-app ブリッジ(実機不可・高速)。kind=physical では xcuitest 以外は検証エラー。"
          },
          "avd": {
            "type": "string",
            "description": "Android: AVD(ID または表示名。起動中エミュレータとの照合で adb シリアルに解決される)。"
          },
          "serial": {
            "type": "string",
            "description": "Android 実機: adb シリアル(USB は \"14141JEC204922\"、WiFi は \"192.168.1.23:5555\")。kind=physical のとき必須。エミュレータでは使わない(avd から解決するため)。"
          },
          "model": {
            "type": "string",
            "description": "デバイスの機種名。表示専用で同定には使わない(登録時に控えるだけ)。iOS シミュレータは Xcode の Model(デバイスタイプ名。例 \"iPhone 17 Pro\")、iOS 実機は marketingName、Android は ro.product.model。"
          }
        }
      }
    },
    "heal": {
      "type": "boolean",
      "description": "セレクタの自己修復(指紋照合方式。同じ type + label の要素を1件だけ探して当てる)を許可するか。FM は使わない(既定 true)。",
      "default": true
    },
    "fmTextVisibilityCheck": {
      "type": "boolean",
      "description": "FM によるテキストの可視性検証(occlusion guard)を有効にするか(既定 true)。",
      "default": true
    },
    "ocrTextVisibilityCheck": {
      "type": "boolean",
      "description": "OCR を使ったテキストの可視性検証(occlusion guard の前段。既定 true)。false で従来どおり FM だけで判定する。fmTextVisibilityCheck が false の run では guard 自体が走らないため効かない。",
      "default": true
    },
    "screenLooksLike": {
      "type": "boolean",
      "description": "screenLooksLike コマンド(FM による画面判定)を有効にするか(既定 true)。",
      "default": true
    },
    "containerInference": {
      "type": "boolean",
      "description": "容器(スクロール領域)の推測に基づくタップ/スクロール座標補正を行うか(既定 true)。false で見切れ判定・掴み直し・救済ドラッグ・座標補正・壊れた座標の候補除外を止める。FM とは無関係の幾何ヒューリスティック。",
      "default": true
    },
    "reportDir": {
      "type": "string",
      "description": "レポート出力先(プロジェクトルート相対 or 絶対。既定 \"reports\")。",
      "default": "reports"
    },
    "defaultTimeout": {
      "type": "number",
      "description": "DSL コマンドの既定タイムアウト秒(小数可。省略時は DSL 側の既定値)。",
      "minimum": 0
    },
    "scenarioTimeout": {
      "type": "integer",
      "description": "シナリオ単位の壁時計タイムアウト秒(ホスト側 watchdog。超過で子を強制終了し失敗扱い。省略時 90)。defaultTimeout(子内部の検証待ち)とは別物。",
      "minimum": 1
    },
    "iosInappEngine": {
      "type": "boolean",
      "description": "iOS の高速な in-app エンジン(ハイブリッド)を使うか(既定 true=ON)。ON → iOS デバイスを hybrid(in-app 主+XCUITest フォールバック)、OFF → xcuitest で駆動する。devices[] の該当エントリで engine を明示している場合はそちらが優先。Android には影響しない。",
      "default": true
    },
    "wipeDataOnBloat": {
      "type": "boolean",
      "description": "省略時 true。実行開始時に Android AVD のイメージ(userdata/cache/snapshots)がしきい値(wipeDataThresholdGB)超過なら Wipe Data してから実行する。",
      "default": true
    },
    "wipeDataThresholdGB": {
      "type": "number",
      "description": "Wipe Data 発動しきい値(GB)。省略時 8。Play イメージは wipe 直後でも userdata が 2〜4GB あるため、4GB 以下にすると毎実行 wipe が発動する。",
      "exclusiveMinimum": 0,
      "default": 8
    },
    "recoverCpuFallbackToGpu": {
      "type": "boolean",
      "description": "実行開始時に、画面凍結で CPU 描画(swiftshader)へ落ちた Android エミュレータを GPU(-gpu host)で起動し直す。GPU モードは起動引数で固定されるため emulator プロセスの再起動が必要で、該当機1台につき run 開始が約1分延びる。省略時 false。",
      "default": false
    },
    "locale": {
      "type": "string",
      "description": "ロケール(Android エミュレータのブート完了時、Wipe Data 後の再起動を含めてブリッジ経由で適用される。iOS には影響しない)。省略時 \"ja_JP\"。",
      "pattern": "^[A-Za-z]{2,3}([-_][A-Za-z0-9]{2,8})*$",
      "default": "ja_JP"
    },
    "homeOnStart": {
      "type": "boolean",
      "description": "run 開始時に各デバイスへ home() を1回撃つ(既定 true = 撃つ)。一斉に launch した直後の端末は「描画要求が無いだけ」で画面が黒いまま止まることがあり、そのままだと凍結と見分けが付かない。入力を1回入れておくと描画が動き出すので予防になる。デバイスあたり1回だけなので実行時間への影響はほぼ無い。",
      "default": true
    },
    "playProtectBypass": {
      "type": "boolean",
      "description": "Android の adb install が Play Protect の照会(「Send app for a security check?」)で無期限に止まるのを防ぐため、install の間だけ verifier_verify_adb_installs を 0 にして元へ戻す(既定 true)。false にするとこのバイパスをせず端末の設定に触らない(release 署名の APK は端末側のダイアログで install が止まったままになり、ツールはそのダイアログに答えない)。",
      "default": true
    },
    "enableAnimations": {
      "type": "boolean",
      "description": "テスト対象アプリのアニメーションを残す(既定 false = 実行開始時にデバイス側のアニメーションを無効化する)。true にすると整定待ちが伸び、Android ではスクリーンショットが遷移途中の絵を掴むことがある。設定は run 開始時に毎回デバイスへ同期される(Android 実機はグローバル設定が永続的に書き換わる)。",
      "default": false
    },
    "responseMeasurement": {
      "type": "boolean",
      "description": "レスポンス計測モード(実験的。既定 false)。Android 実機 1 台だけが対象で、有効なデバイスが 1 台・kind=physical・Android でなければエラー。アニメーションを残し(enableAnimations を true に固定)、fmTextVisibilityCheck・ocrTextVisibilityCheck・screenLooksLike・record・ホスト負荷による減速を止める(これらを true に明示するとエラー)。run の間はモニターを止める。--broadcast・--fleet・--split とは併用できない。",
      "default": false
    },
    "responseRepeat": {
      "type": "integer",
      "description": "レスポンス計測モードで各シナリオを続けて回す回数(既定 5)。2 以上 50 以下。responseMeasurement が true のときだけ指定できる(無しで指定するとエラー)。1 回目は次の操作の対象を覚える回で、反応時間を測らない。",
      "minimum": 2,
      "maximum": 50,
      "default": 5
    },
    "record": {
      "type": "boolean",
      "description": "各デバイスの画面録画を有効化する(既定 true)。録画は results/runs/<YYYY-MM>/<runID>/recordings/ 配下に保存され、モニターパネルの「録画」タブから再生できる。",
      "default": true
    },
    "recordFailuresOnly": {
      "type": "boolean",
      "description": "録画のうち、成功(passed)したテストの録画は保存しない(既定 false)。record が true のときのみ意味を持つ。",
      "default": false
    },
    "recordBitrateKbps": {
      "type": "integer",
      "description": "録画のビットレート(kbps、既定 1500)。record が true のときのみ意味を持つ。",
      "exclusiveMinimum": 0,
      "default": 1500
    },
    "recordFullResolution": {
      "type": "boolean",
      "description": "録画をデバイス画面のフル解像度で保存する(既定 false=縮小)。容量が増える。record が true のときのみ意味を持つ。",
      "default": false
    },
    "remoteControl": {
      "type": "object",
      "description": "リモート実行の制御。ワークスペース(リモートのマシンへ運ぶ資材の置き場)。テストの前後で実行するスクリプトは、その scripts/setup.sh・scripts/teardown.sh が存在すれば自動的に実行される(宣言は不要)。",
      "additionalProperties": true,
      "properties": {
        "workspace": {
          "type": "string",
          "description": "アプリのバイナリや実行スクリプトを置くフォルダ(絶対パス、またはリポジトリルート基準の相対パス)。省略時は TestProjects/<project>/workspace。リモートの Mac にはこのフォルダが運ばれる。",
          "minLength": 1
        }
      }
    }
  }
}
